<?xml version="1.0" encoding="utf-8"?>
<xs:schema xmlns:xs="http://www.w3.org/2001/XMLSchema">
  <xs:element name="Hotels">
    <xs:complexType>
      <xs:sequence>
        <xs:element name="Hotel" maxOccurs="unbounded" minOccurs="1">
          <xs:complexType>
            <xs:sequence>
              <xs:element name="Name" type="xs:string" />
              <xs:element name="Phone" type="xs:string" />
              <xs:element name="Address">
                <xs:complexType>
                  <xs:sequence>
                    <xs:element name="Street" type="xs:string" />
                    <xs:element name="City" type="xs:string" />
                    <xs:element name="State">
                      <xs:simpleType>
                        <xs:restriction base="xs:string">
                          <xs:pattern value="[A-Z]{2}" />
                        </xs:restriction>
                      </xs:simpleType>
                    </xs:element>
                    <xs:element name="Zip">
                      <xs:simpleType>
                        <xs:restriction base="xs:string">
                          <xs:pattern value="[0-9]{5}" />
                        </xs:restriction>
                      </xs:simpleType>
                    </xs:element>
                  </xs:sequence>
                </xs:complexType>
              </xs:element>
            </xs:sequence>
            <xs:attribute name="Rating" use="required">
              <xs:simpleType>
                <xs:restriction base="xs:integer">
                  <xs:minInclusive value="1" />
                  <xs:maxInclusive value="5" />
                </xs:restriction>
              </xs:simpleType>
            </xs:attribute>
          </xs:complexType>
        </xs:element>
      </xs:sequence>
    </xs:complexType>
  </xs:element>
</xs:schema>
