<?xml version="1.0" encoding="utf-8"?>
<Hotels xmlns="https://rahul200512.github.io/cse445-xml"
        xmlns:xsi="http://www.w3.org/2001/XMLSchema-instance"
        xsi:schemaLocation="https://rahul200512.github.io/cse445-xml https://rahul200512.github.io/cse445-xml/Hotels.xsd">
  <Hotel Rating="four">
    <Name>Grand Canyon Inn</Name>
    <Phone>480-555-1234</Phone>
    <Address>
      <Street>100 Main Street</Street>
      <City>Scottsdale</City>
      <State>INVALID</State>
      <Zip>BADZIP</Zip>
    </Address>
  </Hotel>
  <Hotel Rating="6">
    <Name>Bad Hotel</Name>
    <Phone>000-000-0000</Phone>
    <Address>
      <Street>999 Nowhere Blvd</Street>
      <City>Faketown</City>
      <State>XX</State>
      <Zip>00000</Zip>
    </Address>
  </Hotel>
</Hotels>
