<?xml version="1.0" encoding="utf-8"?>
<Hotels xmlns:xsi="http://www.w3.org/2001/XMLSchema-instance" xsi:noNamespaceSchemaLocation="Hotels.xsd">
  <Hotel Rating="4">
    <Name>Grand Canyon Inn</Name>
    <Phone>480-555-1234</Phone>
    <Address>
      <Street>100 Main Street</Street>
      <City>Scottsdale</City>
      <State>AZ</State>
      <Zip>85251</Zip>
    </Address>
  </Hotel>
  <Hotel Rating="5">
    <Name>Desert Rose Resort</Name>
    <Phone>602-555-5678</Phone>
    <Address>
      <Street>200 Camelback Road</Street>
      <City>Phoenix</City>
      <State>AZ</State>
      <Zip>85016</Zip>
    </Address>
  </Hotel>
  <Hotel Rating="3">
    <Name>Tempe Stay Suites</Name>
    <Phone>480-555-9012</Phone>
    <Address>
      <Street>300 University Drive</Street>
      <City>Tempe</City>
      <State>AZ</State>
      <Zip>85281</Zip>
    </Address>
  </Hotel>
  <Hotel Rating="2">
    <Name>Mesa Budget Lodge</Name>
    <Phone>480-555-3456</Phone>
    <Address>
      <Street>400 Southern Avenue</Street>
      <City>Mesa</City>
      <State>AZ</State>
      <Zip>85202</Zip>
    </Address>
  </Hotel>
  <Hotel Rating="5">
    <Name>Sedona Luxury Retreat</Name>
    <Phone>928-555-7890</Phone>
    <Address>
      <Street>500 Red Rock Lane</Street>
      <City>Sedona</City>
      <State>AZ</State>
      <Zip>86336</Zip>
    </Address>
  </Hotel>
</Hotels>
